adversa2|subst., a female opponent, adversary
abecedaria|elementary instruction
AbnobaDiana|the goddess of this mountain
acernia|an unknown fish
Achaja2|The province of Achaia, in the northern part of the Peloponnesus, on the Gulf of Corinth
Acionna|a Gallic deity
adolescentula|a very young maiden;
adventoria|a banquet given on one's arrival
advocata|one called to aid, a supporter
agraria|(sc. lex), an agrarian law,
alabarchia|a kind of customs in Egypt
Alemannia|the country of the Alemanni
alicaria|a prostitute
Aliphira|a town in Arcadia
Alyzea|a small town in Acarnania with a temple dedicated to Hercules, Kandili
amurga|the watery part that flows out in pressing olives, the lees, dregs of oil
AnnaPerenna|an old Italian goddess, the protector, bestower of the returning year, annare perennareque
aprugna|the flesh of a wild boar
arachidna|a wild leguminous plant, a kind of chickling vetch
arboraria|the blackivy
arcuma|a kind of small carriage
ArsiaSilva|a forestin Etruria, celebrated for a battle between the Tarquinii and the Romans
astroonomia|knowledge of the stars, astronomy
Audia|a place in
aurea|the bridle of a horse
Austrania|an island to the north of Germany, Glessaria, the island of Ameland, in West Friesland, Austeravia
bacalusia|a kind of sweetmeat
basilicola|a small church, a little chapel
Bastetania|a district in Spain
batiaca|a kind of drinking-cup
batiola|a small drinking-cup, a goblet
Berrhoea|a town in Macedonia, Irenopolis, north of the river Aliacmon, Verria
blendea|an inferior kind of seafish
bronia|the thunderstone, a precious stone
buccha|The cheek, rouged
Bucephalia|a town in India, on the Hydaspes, built by Alexander, and named after his horse
Bucinna|a small island near Sicily
cachecta|one that is in a consumption
caenatiuncula|a small dining-room
caepuila|a field, bed of onions
calantica|a covering for the head of women, which fell down over the shoulders
calcata|the material for filling ditches, fascines;
camelelasia|camel-driving, the care of the camels belonging to the State
Canusia|a very ancient town in Apulia, Canosa, founded by the Greeks, and celebrated for its excellent wool
cardimoma|a pain in the stomach
carrobalista|a ballista mounted on a carriage
catachana|a tree inoculated with buds of different fruit-trees
catarracta|a waterfall, in gen.; the waterfalls of the Euphrates
cauponaria|a female shopkeeper
Cecina|-I. a surname in the, originating in Etruria -II. a river in Etruria, the Cecina
Cephaleniallania|the largest island in the Ionian Sea, Cephalonia
ceua2|a kind of small cow
chema|a gaping mussel, a cockle
chlora|a medicament
circanea|a bird so named from its circular flight
Cirra|a very ancient town in Phocis, near Delphi
clabula|a scion, graft
Clytemestra|the daughter of Tyndarus and Leda, and sister of Helen, Castor, and Pollux; wife of Agamemnon and mother of Orestes, Iphigenia, and Electra;
cocleola|a small snail
coeliaca|stomach remedy
coenatiuncula|a small dining-room
coloniaria|native of a colony
consponsata|the betrothed, the bride
corocta|an unknown witd animal in Ethiopia, the hyena
corrumptela|that which corrupts, a corrupting, corruption, seduction, bribery
cosmeta|he who ornaments one, an adorner;
crocodilina|a sophism, crocodile, a crocodile-conclusion
Cuballa|a town in
cupedia|Fondness for dainties, daintiness, lickerishness
cynorroda|The dog-rose
Cyparia|a town in Messenia, Arkadhia
Dania|Denmark
dasea|the rough-breathing
dianoea|by which a fact is exhibited instead of a conception
diaphora|distinction
dilatura|a postponement, delay
domucula|a little house, a porch
eclesia|an assembly of the, people.
effectiva|practical art, productive art
emetica|an incitement to vomit, an emetic
emplastra|a plaster.
Erycina|Venus
faeniseca|a mower
farctura|A cramming, fattening
Fessonia|the goddess of weary persons
ficecula|a small bird, the fig-pecker, becafico, in lemm.;
ficetula|a small bird, the fig-pecker, becafico, in lemm.;
flebotomia|blood-letting, phlebotomy
foenisicia|mown hay
fossoria|digging
fringuilla|a small bird, the robin redbreast, the chaffinch
Frivolaria|the title of a comedy of Plautus, of which only a few fragments have been preserved.
Gala|the father of Masinissa
galera|a helmet-like covering for the head, made of undressed skin, a cap, bonnet, hat
gannatura|a snarling, yelping
gannitura|a snarling, yelping
Garamantica|a sort of precious stone
Gargaphia|a valley of B&oelig;vtia sacred to Diana, with a fountain of the same name, where Act&oelig;on was torn to pieces by his hounds
Gebenna|a chain of mountains in Gaul, the Cevennes
genethliologia|the art of calculating nativities, casting horoscopes
Genna|a city of the Allobroges, upon Lake Leman, at the point where the Rhone passes from it, Geneva
Graecula|a Greekling, a weak imitator of Greek women
gymnasiarcha|ext.;
hapaluria|a vessel for soft eggs
hebria|a wine-vessel
Hermagora|A celebrated Greek rhetorician of Rhodes
heroina|a demi-goddess, heroine
Hetruria|a country of central Italy
Hiberina|a female Iberian, a Spanish woman
hieracia|hawkweed
hinnulea|a young hind
Hippodamea|Daughter of &OElig;noma&uuml;s, king of Elis; she became the wife of Pelops, who won her in a race with her father
histrionica|the player's art
horoscopica|the casting of nativities
Hygea|daughter of &AElig;sculapius, and goddess of health
Iamphoryna|the capital of the M&oelig;di in Macedonia, Vrania, Ivorina
inconruptela|imperishableness, incorruptibility
infantaria|a woman fond of infants
innocia|innocence
isagoga|an introduction
Ituraea|A district of C&oelig;lesyria, the inhabitants of which were celebrated as archers, El-Jeidoor
Ityraea|A district of C&oelig;lesyria, the inhabitants of which were celebrated as archers, El-Jeidoor
jacea|a wooden hay-rack
jectura|a throwing, casting
Juliobriga|a town in Hispania Tarraconensis
kalumnia|trickery, artifice, chicanery, cunning device.
lacrimola|a little tear, crocodile-tear
lagaena|a large earthen vessel with a neck and handles, a flask, flagon, bottle
Larga|the name of a woman of bad repute
leocrocota|a wild beast in India
Leonida|A king of Sparta, who fell at Thermopyl&aelig;
Lethaea|the wife of Olĕnus, who, on account of her pride, was turned into stone
Leucata|a promontory in the island of Leucadia, now Capo Ducato
leucographia|a precious stone
literatura|A writing
literula|A little letter
loba|The haulm, straw of Indian millet
locutuleia|a female babbler
longicia|length
Luppia|a river in the north-west of Germany, Lippe
lusoria|a, vessel for pleasure, yacht, any kind of light vessel, cutter
Lycimnia|the name of the wife of a king of Lydia
Lycinna|the name of a girl
macteola|a little delicacy, dainty
Madaura|a city in Numidia, Ayedrah
Maguntia|a city of Germany, on the Rhine, Mayence
Majja|-I. Daughter of Atlas and Pleione, and the mother of Mercury by Jupiter -II. A daughter of Faunus
Malacha|a city of, Malaga
Malevola|a female enemy, foe
malogranata|a pomegranatetree
mammamilla|a breast, pap, nipple, teat
mantichora|a fabulous Indian beast, with a human face, a lion's body, and a scorpion's tail
manulea|A long sleeve
Marucca|a town in Batica
Masanisa|a king of Numidia, grandfather of Jugurtha, at first the enemy and afterwards the friend and ally of the Romans
Massala|a town of Arabia Felix
matela|a pot, a vessel
materiaria|the trade in timber
mattiocopa|a cutter of dainties;, a skinflint
melitaena|A plant, also called
mellitula|little honey
meloda|a melody
mennonia|a precious stone, of a black color
mercantia|trade
Mercantilla|a Roman proper name
Mercatilla|a Roman proper name
mespila|a medlar-tree
MessiaSilva|a wooded hill on the right bank of the Tiber, south-west of Veii
messura|a reaping
Mestria|a Roman surname
Mevia|a woman fond of masculine sports
milua2|a she-kite
mira|a part, a degree
mistura|a mixing, mingling
Moguntia|a city of Germany, Mayence, Mainz
monarcha|an absolute ruler, a monarch
Montanilla|a Roman surname
muchula|the Persian name of the precious stone
Murtea|An epithet of Venus, said to be taken from the myrtle, which was sacred to her
mustricola|a shoemaker's last
mya|a kind of mussel
mylasia|a kind of hemp
mythologia|mythology, a work of Fulgentius, in which the origin of the myths is indicated
Nabdalsa|a distinguished Numidian, a general of Jugurtha
narthecya|f, a low species of
Nausistrata|name of a woman
neclegentia|carelessness, heedlessness, negligence, neglect
Nephusa|a Roman surname
Neverita|a sea-goddess
obedientia|obedience
obsequella|compliance, complaisance, obsequiousness, through obsequiousness in speaking, because they spoke as he liked
Officiosa|a Roman surname
olivita|the olive-harvest
Onesima|a Roman surname
Onomasta|a Roman surname
opicerda|sheep's dung
oppugnantia|resistance, opposition
orinda|Ethiopian bread
Ossipaga|bone-fastener
Ossipanga|bone-fastener
Ostrogotha|an Ostrogoth
ovicerda|sheep's dung
Pacatula|a female proper name
Pactya|a town of Thrace, Doghan Arslan
Palica|a town in Sicily.
palilogia|the emphatic repetition of a word, idea
Palmyrena|the country around Palmyra
pandecta|a book that contains every thing, a complete repertory, an encyclopedia
Pantagia|a small river in the eastern part of Sicily, between Megaris and Syracuse, Fiume di Porcari
parangaria|a service over and above that which one is bound to render, extra service
parietaria|the herb pellitory, parietary
parocha|a supplying of necessaries, purveyance
Parrasia|a town of Arcadia
Patellana|a goddess that presiaed over the shooting of grain
Pelopeia|a female descendant of Pelops
peregrina|a foreign woman
perscriptura|a drawing up, a writing
Pexsa|a Roman cognomen
Phalacrina|a town in the Sabine territory, the birthplace of the emperor Vespasian
phasiana|a pheasant
Philisthaea|the southwestern portion of Canaan, Philistia;, another name for Pal&oelig;stina
phulacista|a jailer;, of a creditor who duns for his money, and makes a prisoner of the debtor by keeping a watch on his house
pigneraticia|an action on account of a pledge
Pisaea|Hippodamia
planeta|a wandering star, planet
Plistia|a city of the Samnites
Poeessa|An ancient name of the island of Rhodes
Polydecta|a king of Seriphus, who brought up Perseus
Pompeja2|name of a Roman gens, the triumvir, fem., his sister
Poplicula|a surname of, and of his descendants
porcula|a little sow
praepollentia|excellence
pressoriola|a repository
Proerna|a town of Thessaly, Ghynekokastro
Psittalia|a small island in the Saronic Gulf, near Salamis
Pulcra|a Roman surname of the, a promontory in Northern Africa, north-east of Carthage, Cap Bono
puppa|A girl, damsel, lass
purpuretica|an entrance built of porphyry
putilla|a little boy; a little girl; a child;
Quieta|a woman's name
Quinctilia|the name of a Roman gens
ramula|the hoof
redimicula|a band.
refutatiuncula|petty attempts at refutation
registoria|a treasurer
revocatoria|a letter of recall
ridicula|a little stake, a peg, plug
rupa|a rock, a cliff
rusticola|an inhabitant of the country
sambycistria|a woman that plays on the
sanderaca|Sandarach
Sauromata|the country of the Sarmatians, Sarmatia
Scaeaporta|the Sc&oelig;an, subst., the Sc&oelig;an gate
scaenica|a female player, an actress
Scaevula|A surname of, who made his way into the camp of Porsenna to kill him, and, on being discovered, burned off his own right hand
Schoeneia|Atalanta
scidula|a small leaf of paper
scribilita|a kind of tart
securiclata|a weed growing among lentils, hatchet-vetch
sedda|a seat, settle, chair, stool
sertaCampanica|a plant, called also
sexungula|six-claws
Sigambra|a Sigambrian, woman
Sigambria|the country of the, Sigambria
Sindica|a part of Scythia on the Black Sea
Singania|a river of Pontus
siptachora|a tree in India that yields amber;
sircula|a kind of grape
Siria|a country in Asia, on the Mediterranean Sea, Assyria
Solva|a city of Noricum
Soricaria|a town of
sphinthria|a male prostitute
Sthenoboea|daughter of Iobates, king of Lycia
sticha|a kind of vine
stipa|the coarse part of flax, tow, hards, oakum
striata|a species of shellfish;, a scallop
strictivilla|an appellation of a vile woman
strumea|an herb that cures the struma
suadella|Exhortation, suasion, persuasion
suavifragrantia|fragrance
subjacentia|the being a subject
Sufetula|a town in Africa
sulaba|a syllable.
sumbola|a contribution, a share, scot, shot
Sybarita|an inhabitant of Sybaris, a Sybarite
tarpezita|a money - changer, banker
tenebra|darkness
testiculata|(sc. herba), a plant, called also mercurialis and orchion
thyia|the Greek name for the citrus-tree
Tirynthia|Alcmena, the mother of Hercules
Titia|the name of a Roman gens, a tribune of the people, whose motions so much resembled dancing that a certain dance was named, after him
tribacca|an ear-drop consisting of three pearls
tumbula|a little tomb
Vacea|a river of Lusitania, the Vonga, Conga
valva|the leaf of a door, a folding-door; sing.
Veja2|a proper name of a woman
vessica|the bladder, the urinary bladder.
vetula|a little old woman
vindicia|a laying claim to, a legal claim, has falsely obtained possession of the thing claimed
visula|a kind of vine
vitilena|a bawd, procuress
volpecula|a little fox
volsilla|a kind of pincers, tweezers.
volvola|the plant
xeromyrrha|dry myrrh
zancha|a kind of soft Parthian shoe
zanga|a kind of soft Parthian shoe
zinzala|a kind of gnat
Actaea2|a female Athenian; of Orithyia
biblia|the Bible
Bovilla|A small but very ancient town in Latium, a colony from, about twelve miles from Rome, on the Appian Way
Cinyra2|A king in Assyria, afterwards in Cyprus; father of Myrrha, and, by her, of Adonis
deserta|the abandoned wife
falisca2|a rack in a manger
galbina|a small bird
Lappa2|a Roman surname; e. g. Rubrenus Lappa, a tragedian
Ligariana|Cicero's oration for Ligarius
Lucia|a country of Asia Minor, between Caria and Pamphylia, where was the volcano Chim&aelig;ra
Lucia2|a Roman prænomen
melica2|a kind of vessel
Moera2|the name of one of the Fates
murrina|a drink made of good wine, flavored with myrrh and other spices
Nepeta|a city in Etruria, now Nepi
Nephela2|a Roman surname
Nepotilla2|a Roman surname
obsiana|a kind of glass, obsidian
ophiussa2|a magical herb growing on the island of Elephantine
ortygia2|a quail
Posca2|a Roman surname
Simila2|the goddess who pricks on, excites, stimulates to action or pleasure
strebula|the flesh about the haunches
Bacca2|a Bacchanet, a female attendant of Bacchus, who, in company with Silenus and the Satyrs, celebrated the festival of that deity with a raving madness carried even to insensibility, with an ivy crown upon her head, a fawn-skin upon her left shoulder, a staff wound with ivy in her hand, and with hair loose and flying wildly about
Bucephala2|the horse of Alexander the Great
Lacerna2|the name of a rich charioteer
lora2|a thong; the mouth of a skin, leathern bag
Machaera2|an auctioneer
Minutia2|the name of a Roman gens
samia2|hurt, damage, loss
immemoria|unmindfulness, forgetfulness
offerumenta2|a present; a stripe, cut
scutulata2|a checked, chequered garment
adjuncta|additional circumstances, adjuncts, things closely connected with, belonging, suitable to
Aequana|a mountain range near Sorrentum
Allifana|large-sized drinking-cups made there
anapaestica|anapaestic verses (once; al. anapaestos).
aota|see actum.
austrina|the southern regions of a country
balistia|music, songs accompanying dancing
benefacta|esse.
bucita|a pasture for cattle, cow-pasture
captiosa|sophisms
celata|secrets
centuplicata|a hundredfold
cerina|a wax-colored garment
chalcea|brazen things
cliva|a gently sloping height, a declivity, slope, an ascent, a hill, eminence, ascending road, the higher road ascending to the Capitol, a part of, absol., a great difficulty to be overcome, any thing sloping, a slope, unevenness
cogitata|reflections, thoughts, ideas
commetacula|rods carried by the flamens
concepta|subst., measures, capacity
confraga|a rough place, thicket, Comp., sup.
contaminata|adulterated things, Comp.
controversa|disputed, doubtful points
coppadia|dainty dishes, tidbits, delicacies
Corinthia|works of art made of it
cosmica|worldly things
cotona|a kind of small Syrian fig
creata|things made
culpanda|to declare something as a crime, to impute a fault to, to complain of, find fault with
Cyclopea|the myth of the Cyclopes as represented in a pantomime
Cyrea|The name of a youth
data|gifts, presents
derupta|precipices
devia|lonely, unfrequented places
diathyra|an enclosure
diatreta|pierced work, filigree-work
dumeta|thorn bushes, a thorn-hedge, thicket, intricacy, obscurity
effusa|the urine
Empedoclea|Empedoclean doctrines
enucleata|the essence, the condensed meaning
epiredia|traces, carts, wagons
ergastula|the inmates of a workhouse, penitentiary convicts, masc. sing.
exanima|half dead with fear, terrified, dismayed
exposita|the open parts, those exposed to view
factitamenta|things made, works
farticula|a little stuffing
ferramenta|implements of iron, tools shod with iron, irons, axes, swords, tools
foenisecta|mown hay;
fructeta|bushes, thickets
Glossemata|a name given to collections of such words with explanations
halcedonia|the fourteen winter days during which the kingfisher broods and the sea is calm, a deep calm, profound tranquillity
Heduphagetica|the title of a poem of Ennius;
heminaria|presents of the measure of a
hypaethra|uncovered, open walks
impertita|favors, concessions
inausa|unattempted things, deeds beyond daring
incohamenta|first principles, rudiments, elements
infectiva|dye-stuffs, dyes
inferialia|sacrifices to the dead
intima|the inmost parts
invectiva|invectives, abuse
irrigua|Overflowings
lacticinia|a dish prepared with milk and eggs
lacunaria|panels of the under surface of a cornice
Lagarina|a kind of wine
libamenta|a portion offered to the gods, libation, first-fruits
licita|things that are lawful
limosa|muddy, miry places
meditata|a carefully prepared speech
moderna|things, institutions of the present
monoptota|nouns which have but one case-ending, monoptotes
mystica|things pertaining to secret rites
Nautaca|a city of Sogdiana, near the river Oxus, probably between the mod. Samarcand and the river Amur
Ortopana|an ancient city of Bactriana;
pacifica|peace-offerings
Pammenia|of or belonging to Pammenes
pannicularia|rags, tatters, ragged clothes
parapherna|the separate possessions of a married woman, her property besides her dower
penita|the inmost parts
pennata|winged creatures, birds, Comp.
perniciosa|baneful things
perturbata|confused visions, perverted truths
petrosa|rocky places
polimenta|the testicles
polymita|damask
Popugia|a festival in memory of the people's flight to the rescue of the Latins
potulenta|drinkables, drinks
praecipua|excellence, superiority
problematica|problems, cases set forth as problems
producta|preferable things
purulenta|corrupt matter, pus
recauta|a quittance, release
recondita|remote, sequestered places
retinacula|a holdfast, band, tether, halter, halser, rope, cable
sabuleta|sandy places
saxosa|rocky, stony places
semetra|irregular, inharmonious
serpirperastra|knee-splints, knee-bandages
sicilimenta|what is cut, mown with the sickle, the aftermath
Sicyonia|Sicyonian shoes
sigillaricia|little images;
sigilliola|little figures, images
stratoria|bedding
sugillata|black-and-blue spots, bruises
sulfurata|Brimstone-matches
summissa|Calm passages, quiet sayings
tegumenta|a cover, coverings, clothing
terriculamenta|things that excite terror, frights, terrors, Sing.
tragematia|sweetmeats, confectionery
transversaria|cross-beams
trechedipna|Greek slippers (worn by parasites)
truculenta|fierce conduct, language
uliginosa|swamps, marshes
VadaVolaterrana|a port in Etruria south of Pisa, Torre di Vado
velamenta|olive-branches wound with woollen fillets
venenata|venomous animals
virecta|a green place, greensward, grass-plats
vitiosa|misfortune, ruin
colocasia2|an Egyptian bean;
cotonea2|a quince or quince-apple
cydonia2|a quince or quince-apple
excellentia2|exceptional instances
Ligariana2|Cicero's oration for Ligarius
primigenia2|the first principle, nature
rhetorica2|rhetoric
terricula2|means of exciting terror, a fright, scarecrow, bugbear
Bucephala3|a town in India, on the Hydaspes, built by Alexander, and named after his horse
lora3|the reins of a bridle, A whip, lash, scourge
moenia2|duties, functions, official, professional duties
multa2|many things, much
secta2|parts of the body operated upon
scopulosa|rocky places
carnalia|carnal things
peristromata|coverings, carpets
polimina|the testicles
posteriora|the posteriors
Hylax|Barker, the name of a dog
naufylax|one who kept watch over the luggage on shipboard
Anthrax2|name of a slave
rapax3|a beast of prey
choeras|the scrofula
Niphas|a Roman surname
Nymphias|a Roman surname
Phaethontias|a Pha&euml;thontiad, a sister of Pha&euml;thon.
Phthias|a Phthian woman
Pimplias|a Pimpliad, a Muse
Plejas2|One of the Seven Stars, a Pleiad;, the constellation of the Seven Stars, the Pleiades, Pleiads, the seven daughters of Atlas and Pleione
selinas|a kind of cabbage resembling parsley
aconae|pointed stones
Aremoricae|some of the northern provinces of Gaul, Bretagne, with a part of Normandy
Baraomutae|a people of India
Bargyletae|the inhabitants of Bargylice
Basiliadae|a people of Sarmatia
bonae|good women
brassicae|varieties of cabbage
Buzae|a people of India
Calydoniae|the Calydonian women
clunae|apes;
cornutae|a kind of sea-fish.
cotoriae|a whetstonequarry
Curietae|the inhabitants of Curieta, an island on the coast of Illyria, Veglia
cyparissiae|a kind of fiery meteors
Daesitiatae|a people in the south of Pannonia Superior
Dassaretae|a people of Illyria
decemmodiae|baskets holding each ten modii
echinometrae|a sort of sea-urchin
Erecthidae|the Athenians
ethecae|a gallery, portico
Faunigenae|descendants of Faunus
Gargaridae|an Indian people near the Ganges, in the modern Bengal
Germaniae|the whole of Germany
geseoretae|a sort of boat
indecorae|ill-favored women
inficiae|denial
lanatae|wool-bearers, sheep
Laomedontiadae|Trojans
Leboriae|a district in Campania, lying around Capua and Nola, Terra di Lavoro
Lechaeae|the port of Corinth, on the Corinthian Gulf
lupariae|brothels
Maleae|a promontory in the Peloponnesus, at the south of Laconia, C. Malea
mariscae|the piles
Melae|a town in the Samnite country
Molae|the daughters of Mars, the protectresses of mills
Nemetae|a people of Gaul, in the neighborhood of the modern Spires
Oenusae|three islands near Messenia
palangae|a pole to carry burdens on, carrying-pole
Parapamisadae|the inhabitants of that mountain
pezitae|mushrooms without a root, without a stalk
Pindenissae|the inhabitants of Pindenissus
porriciae|the parts of the victim consecrated to the gods, sacrificial pieces, med.
primiciae|the first things of their kind, firstlings.
ratariae|small vessels made of logs fastened together, rafts
reminiscentiae|recollections, remembrances, reminiscences
residuae|arrears, dues, slothfui, inactive;
Rosellae|a town of Etruria, Rosello.
sandaligerulae|maids who carried their mistresses, slippers, sandal-bearers, slipper-carriers
secundinae|the after-birth
semicupae|a halftun;, pot-belly, fat-paunch
sertae|wreaths of flowers, garlands
Stasiastae|the name of a tragedy of Attius
stolatae|noble dames, matrons
Tentyritae|the inhabitants of Tentyra, Tentyrites
tractoriae|an imperial letter containing an order to provide a person with necessaries on his journey
Venereae|a kind of mussels, Venus-shell
versutiae|cunning, craftiness, subtlety
baccanal|a place devoted to Bacchus, the place where the festivals of Bacchus were celebrated
mercans|a buyer, purchaser
itinerans|a traveller
litigans|S.
Paeas|the father of Philoctetes
Dabar|a Numidian, a relative of Masinissa and an intimate friend of Bocchus
Aleuas2|A tyrant of Larissa, slain by his own servants
Astosabas|a river of Ethiopia falling into the Nile, Abai
Cantabras|a tributary of the Indus, Tschandrabagha
cinaedias|a precious stone, said to be found in the brain of the fish
climatias|a kind of earthquake
Limaeas|a river of, Lima
napthas|naphtha
onotheras|a plant, also called
Pagidas|A river in Africa
Teleboas|a centaur killed by Nestor at the marriage of Pirithous
Antemnas|belonging to Antemn&oelig;;
Bergomas|of Bergomum
Caninefas|of Caninefas
Lirenas|of or belonging to the Liris
Lirinas|of or belonging to the Liris
Merinas|of or belonging to the city of Merinum, in Apulia
Pisas|Pisatic, Pisan
Anxuras|belonging to Anxur
auctumnitas|The season of autumn, the autumn, harvest-time
authoritas|a producing, production, invention, cause
autoritas|a producing, production, invention, cause
calumma|a covering
Carinas|a Roman surname
cauteroma|a brand
furiositas|rage, fury
inconruptibilitas|imperishableness, incorruptibility
insuasabilitas|the incapacity to be persuaded
inviolabilitas|inviolability
linguositas|loquacity
magnas|a great man, important person, magnate
maxumitas|greatness, magnitude
mutilitas|imperfection, defect
negociositas|a multitude of business
nummisma|a piece of money, a coin
obscaenitas|Unfavorableness, inauspiciousness
obscoenitas|Unfavorableness, inauspiciousness
pronitas|inclination, propensity, proneness
solemnitas|A solemnity, festival, celebration
solennitas|A solemnity, festival, celebration
spinositas|thorniness
spiritualitas|spirituality, med.
stremma|a dislocation
totietas|the whole, entirety
chama2|a lynx
Britto|-I. A Briton -II. An inhabitant of Bretagne, in France
Cephissias|fem., of Cephisus, the banks of the Attic Cephisus
coeles|heavenly, celestial
Potnias|f., of Potni&oelig;, Potnian
pravicors|that has a depraved heart
alex|the sediment of a costly fish-sauce, the sauce prepared from small fish, fish-pickle, fish-brine
altispex|looking down from a height
Anxyr|An ancient town in Latium, situated not far from the sea-shore, Terracina
arvix|male sheep, a ram. a ram for offering
bellans|see bello.
Bogus|son of Bocchus and king of Mauritania, captured and slain bg Agrippa
conloquens|one who converses, avoiding interviews
coris|a plant, a species of hypericon, the seed of it
Dryops|One of the Dryopes, a people of Epirus
